{
  "probe": "risk",
  "issues": [
    {
      "title": "is_realtime 字段位置在 payload 与事件对象顶层之间约定不一致，可能导致实时路径无法触发",
      "type": "risk",
      "severity": "high",
      "evidence": "方案第1步要求调用方在 payload 中增加 {\"is_realtime\": true}；方案第2步说明原生桥从“事件对象顶层”读取 is_realtime。",
      "why_it_matters": "如果事件对象顶层不是 payload（例如原生桥接收的是包含 name/payload 的封装事件），is_realtime 将不会被读取，支付成功事件会继续走批量队列，无法满足“尽快上报”的需求。",
      "confidence": 0.85
    },
    {
      "title": "支付成功页 await reportEvent 直接违反“上报失败不能阻塞支付成功页”的硬约束",
      "type": "risk",
      "severity": "blocker",
      "evidence": "需求背景明确“上报失败不能阻塞支付成功页，也不能改变支付结果”；方案第3步要求“支付成功页执行 await reportEvent(...)，确认上传成功后再展示结果页”。",
      "why_it_matters": "await 会挂起支付成功页的展示直到上报完成；若上报失败或抛异常，结果页无法展示或需要额外处理，实质上让上报结果阻塞了支付成功页，违反硬约束。",
      "confidence": 0.95
    },
    {
      "title": "实时重试与批量回退缺少 event_id，会导致服务端无法去重",
      "type": "data",
      "severity": "high",
      "evidence": "需求背景指出“服务端仅对带有 event_id 的事件去重”；方案第4步设计了“实时上传失败时立即重试三次；仍失败则重新放入批量队列”，但全文未提及生成或携带 event_id。",
      "why_it_matters": "同一条支付成功事件在实时重试3次及后续批量队列重试时，会因缺少 event_id 被服务端视为多条独立事件，造成数据重复。",
      "confidence": 0.9
    },
    {
      "title": "验收方式仅在开发环境验证，缺少生产可观测性覆盖",
      "type": "observability",
      "severity": "medium",
      "evidence": "方案第6步验收方式仅说明“开发环境能看到支付成功事件请求立即发出，普通事件仍进入批量队列”。",
      "why_it_matters": "未覆盖生产环境的实时路径失败率、批量回退比例、重复事件量、旧客户端表现等关键指标，线上异常无法及时发现。",
      "confidence": 0.85
    }
  ],
  "missing_questions": [
    "is_realtime 的读取位置究竟在 payload 内还是事件对象封装层？需要确认 JS 与原生桥之间的契约。",
    "是否要求旧客户端也必须支持支付成功事件的实时上报？",
    "实时上传与批量上传是否使用同一服务端接口？两个线上服务端版本是否需要改造？",
    "重试和批量回退时 event_id 由哪一层生成、如何保持跨队列唯一？",
    "await reportEvent 失败时的异常处理策略是什么，如何确保不阻塞结果页也不改变支付结果？"
  ],
  "false_positive_risks": [
    "实时上传会压垮服务端：输入未提供服务端容量、QPS 上限或历史负载数据，无法从“实时上报”推导出服务端过载。",
    "降级为批量队列本身违反 ASAP 需求：方案明确将批量队列作为实时失败后的兜底策略，输入未声明“必须始终实时到达”，因此不能判定兜底机制违规。",
    "旧客户端会因新字段崩溃：is_realtime 只是新增字段，输入没有证据表明旧客户端对未知字段敏感或会拒绝解析，不能推断不兼容。"
  ]
}
