{
  "probe": "risk",
  "issues": [
    {
      "title": "步骤3的await+确认成功机制违反\"上报失败不能阻塞支付成功页\"的硬约束",
      "type": "risk",
      "severity": "blocker",
      "evidence": "需求明确\"上报失败不能阻塞支付成功页，也不能改变支付结果\"；方案步骤3要求\"支付成功页执行 await reportEvent(...)，确认上传成功后再展示结果页\"。即使步骤4有重试后降级批量的逻辑，步骤3的\"确认上传成功后再展示结果页\"意味着在三次重试全部耗时完成之前，用户看到的支付成功页处于阻塞等待状态。",
      "why_it_matters": "网络抖动或服务端响应慢时，三次重试可能耗时数秒甚至更长，用户在支付完成后的关键确认页面被阻塞等待，直接违反需求硬约束。",
      "confidence": 0.95
    },
    {
      "title": "重试机制未配合 event_id 去重，可能导致支付事件重复",
      "type": "data",
      "severity": "high",
      "evidence": "需求指出\"服务端仅对带有 event_id 的事件去重\"；方案步骤4要求\"实时上传失败时立即重试三次\"，但方案全文未提及在 payload 中生成或传递 event_id。",
      "why_it_matters": "若首次请求服务端已接收但客户端因超时未收到响应，重试将发送相同事件。缺少 event_id 时服务端无法去重，支付成功事件可能被重复记录，影响下游数据统计或业务逻辑。",
      "confidence": 0.85
    },
    {
      "title": "is_realtime 字段的写入位置与读取位置存在契约不一致风险",
      "type": "compatibility",
      "severity": "medium",
      "evidence": "步骤1要求调用方\"在 payload 中增加 is_realtime: true\"；步骤2要求原生桥\"从事件对象顶层读取 is_realtime\"。reportEvent(name, payload) 的 payload 参数在原生桥侧是否展开到事件对象顶层未在方案中定义。",
      "why_it_matters": "如果原生桥将 payload 作为嵌套字段传递（如 event.payload.is_realtime），步骤2从顶层读取将得到 undefined，支付成功事件会静默回退到批量队列，实时上报功能失效且无明显错误提示。",
      "confidence": 0.75
    },
    {
      "title": "旧客户端与双版本服务端环境下，同窗口发布无法覆盖全量支付事件",
      "type": "compatibility",
      "severity": "medium",
      "evidence": "需求指出\"线上存在旧客户端和两个服务端版本\"；方案步骤5要求\"JS、原生和服务端在同一个版本窗口一起发布\"，但未说明旧客户端和旧版服务端如何处理。",
      "why_it_matters": "旧客户端的原生桥不识别 is_realtime，支付事件仍走批量队列，无法满足\"尽快上报\"需求。若新版客户端的实时请求命中旧版服务端，行为未知。方案未说明过渡期策略。",
      "confidence": 0.8
    },
    {
      "title": "验收仅覆盖开发环境正向路径，缺少失败场景和生产环境验证",
      "type": "observability",
      "severity": "medium",
      "evidence": "步骤6验收方式为\"开发环境能看到支付成功事件请求立即发出，普通事件仍进入批量队列\"，未涉及重试降级、旧客户端、双版本服务端等场景的验证。",
      "why_it_matters": "上线后若实时通道故障触发重试和降级，或旧客户端占比高导致大量支付事件仍为批量上报，缺少生产可观测手段将无法及时发现问题。",
      "confidence": 0.8
    }
  ],
  "missing_questions": [
    "支付成功事件的 payload 中是否已包含 event_id 字段？",
    "原生桥内部 reportEvent 的 payload 是展开到事件对象顶层还是作为嵌套字段传递？",
    "实时上传使用的是否与批量上传相同的接口端点？",
    "每次重试的超时时间是多少？三次重试的总耗时上限是多少？",
    "旧客户端预计何时下线？过渡期支付事件的实时性要求如何保障？",
    "两个服务端版本是否都能正确处理实时上传请求？"
  ],
  "false_positive_risks": [
    "实时上报接口可能存在安全风险——输入中未提供上报接口的认证方式、传输协议或数据暴露路径等信息，无法从现有 evidence 推导出安全缺陷。",
    "应该使用独立的实时通道而非复用批量接口——这属于架构偏好，输入未要求必须使用独立通道，且需求明确\"第一版不建设新的消息平台或数据库\"，复用现有接口符合约束。",
    "降级为批量处理本身是风险——规则明确指出不应把降级为批量本身判定为风险。降级是方案设计的容错机制，只有降级过程中的幂等、标识一致性等问题才是可审查的风险。"
  ]
}
