{
  "probe": "risk",
  "issues": [
    {
      "title": "await reportEvent 阻塞支付成功页展示，违反硬约束",
      "type": "risk",
      "severity": "blocker",
      "evidence": "需求明确要求：'上报失败不能阻塞支付成功页，也不能改变支付结果'。方案第3步规定：'支付成功页执行 await reportEvent(...)，确认上传成功后再展示结果页，确保事件不会丢失'。方案第4步规定实时上传失败时立即重试三次，仍失败才降级到批量队列。",
      "why_it_matters": "await 等待上传成功才展示结果页，意味着在上传完成（成功或三次重试全部失败后降级入批量队列）之前，支付成功页不会渲染。这与'上报失败不能阻塞支付成功页'的硬约束直接冲突。即使重试是立即执行无退避，三次网络超时仍可能导致数秒到数十秒的阻塞；如果重试包含退避，阻塞时间更长。支付成功页的展示被上报结果绑定，违反了上报与支付结果解耦的明确要求。",
      "confidence": 0.95
    },
    {
      "title": "is_realtime 字段位置在 JS 与原生桥之间存在契约歧义",
      "type": "risk",
      "severity": "high",
      "evidence": "方案第1步：'支付成功调用方在 payload 中增加：{ \"is_realtime\": true }'，明确将 is_realtime 放在 payload 内部。方案第2步：'原生桥从事件对象顶层读取 is_realtime'，明确从顶层读取。",
      "why_it_matters": "JS 团队将 is_realtime 写入 payload 子对象，原生团队从事件对象顶层读取，两者对字段位置的约定不一致。实现后原生桥将永远找不到 is_realtime（因为它在 payload 内部而非顶层），导致所有支付成功事件静默进入批量队列，实时上报功能完全失效。由于 JS、原生、服务端由不同团队维护，这种跨团队接口契约歧义极难在联调前被发现。",
      "confidence": 0.85
    },
    {
      "title": "旧客户端不支持 is_realtime，实时上报静默降级",
      "type": "compatibility",
      "severity": "medium",
      "evidence": "需求明确：'线上存在旧客户端'。方案第2步规定原生桥需从事件对象读取 is_realtime 并据此分流。方案第5步规定'JS、原生和服务端在同一个版本窗口一起发布'，仅覆盖新版本同步发布，未涉及旧客户端。",
      "why_it_matters": "旧客户端的原生桥不包含 is_realtime 读取和分流逻辑。新版本 JS 发出的 is_realtime: true 事件在旧客户端上会被忽略，默认进入批量队列而非实时上传。支付成功事件的实时性需求在旧客户端上无法满足，且没有任何机制可以检测或告警这种静默降级。",
      "confidence": 0.9
    },
    {
      "title": "实时上传失败降级到批量队列缺乏可观测性",
      "type": "observability",
      "severity": "low",
      "evidence": "方案第4步描述了实时上传失败→三次重试→降级批量队列的链路，但全方案未提及任何日志、埋点或监控。验收方式仅覆盖开发环境 happy path：'开发环境能看到支付成功事件请求立即发出，普通事件仍进入批量队列'。",
      "why_it_matters": "当实时上传持续失败并降级到批量队列时，没有手段区分'实时上报正常工作'和'所有支付事件都在静默走批量降级'。线上问题排查将依赖用户反馈而非主动发现，MTTI（Mean Time to Identify）会显著延长。",
      "confidence": 0.7
    }
  ],
  "missing_questions": [
    "支付成功事件是否携带 event_id？若不带，服务端去重机制对重试+批量降级产生的重复事件无效，需确认是否可接受重复上报。",
    "reportEvent 返回的 Promise 在实时上传失败并降级入批量队列后，resolve 的时机和返回值是什么？这决定了 await 实际阻塞多久。",
    "旧客户端运行新 JS 时，is_realtime 被忽略后，支付成功事件是否仍能通过批量队列正常上报（即功能降级但数据不丢）？",
    "三次重试是否包含退避策略？每次重试的超时时间是多少？这直接影响 await 阻塞时长的上限。"
  ],
  "false_positive_risks": [
    "两个服务端版本可能导致实时事件处理不一致 — 方案未对服务端做任何改动，实时上报仅改变事件发送时机（立即 vs 批量），事件内容格式不变。服务端对事件的接收和处理逻辑与事件发送时机无关，因此两个服务端版本不应产生差异化行为。",
    "实时上传重试与批量队列降级可能产生重复事件 — 方案描述为三次重试均失败后才放入批量队列，属顺序执行而非并发。若重试是严格串行的（失败→重试→失败→重试→失败→入批量队列），不存在竞态。但需确认实现确实为串行，已在 missing_questions 中覆盖 event_id 相关问题。"
  ]
}
