{
  "probe": "risk",
  "issues": [
    {
      "title": "await 阻塞支付成功页，违反硬约束",
      "type": "risk",
      "severity": "blocker",
      "evidence": "需求明确\"上报失败不能阻塞支付成功页，也不能改变支付结果\"；方案步骤3写\"支付成功页执行 await reportEvent(...)，确认上传成功后再展示结果页\"",
      "why_it_matters": "await 等待上传成功才展示结果页，上传失败时需经历3次重试后才回退批量队列，整个过程耗时阻塞页面展示，直接违反\"上报失败不能阻塞支付成功页\"的硬约束。即使最终回退批量队列，await 期间页面仍不可见。",
      "confidence": 0.95
    },
    {
      "title": "实时上报+重试缺少 event_id 去重保障",
      "type": "data",
      "severity": "high",
      "evidence": "方案步骤4规定\"实时上传失败时立即重试三次\"；需求说明\"服务端仅对带有 event_id 的事件去重\"；方案 payload 示例和全文均未提及 event_id",
      "why_it_matters": "重试场景下同一事件可能被服务端接收多次（首次请求因网络错误返回失败，但服务端已成功入库，随后重试再次入库）。若无 event_id，服务端无法去重，支付成功事件会被重复计数。",
      "confidence": 0.85
    },
    {
      "title": "is_realtime 字段放置层级与原生桥读取层级不一致",
      "type": "risk",
      "severity": "high",
      "evidence": "方案步骤1写调用方\"在 payload 中增加 { is_realtime: true }\"，即 is_realtime 位于 payload 内部；步骤2写\"原生桥从事件对象顶层读取 is_realtime\"",
      "why_it_matters": "调用方将 is_realtime 放在 payload 内，而原生桥期望从事件对象顶层读取。若事件对象结构为 { name, payload }，则 is_realtime 位于 payload 子层级而非顶层，原生桥按顶层读取将找不到该字段，导致所有事件均走批量队列，实时路径功能失效。",
      "confidence": 0.8
    },
    {
      "title": "验收仅覆盖开发环境，生产环境实时路径无可观测性",
      "type": "observability",
      "severity": "medium",
      "evidence": "验收方式为\"开发环境能看到支付成功事件请求立即发出，普通事件仍进入批量队列\"；方案全文未提及生产环境的监控、日志或指标来区分实时路径与批量路径",
      "why_it_matters": "生产环境无法区分事件是否走了实时路径、实时上报成功率、重试触发频率以及有多少事件回退到批量队列，问题发生时缺乏排查依据。",
      "confidence": 0.7
    },
    {
      "title": "旧客户端支付成功事件无法走实时路径，方案未明确是否需兼容",
      "type": "assumption",
      "severity": "medium",
      "evidence": "输入说明\"线上存在旧客户端\"且\"支付成功事件需要尽快上报\"；方案仅描述新版本原生桥读取 is_realtime 的行为，未提及旧客户端策略",
      "why_it_matters": "旧客户端的原生桥不读取 is_realtime，支付成功事件仍走批量队列，上报延迟与需求\"尽快上报\"的目标不一致。方案隐含假设仅新客户端需要实时上报，但需求未限定客户端版本范围。",
      "confidence": 0.65
    }
  ],
  "missing_questions": [
    "实时上传的\"上传接口\"是否与批量上传使用同一端点？若不同，线上两个服务端版本是否均支持该端点？",
    "当前支付成功事件的 payload 是否已包含 event_id？若包含，重试时 event_id 是否保持不变？",
    "\"尽快上报\"的延迟容忍阈值是多少？这决定重试耗时的可接受上限。"
  ],
  "false_positive_risks": [
    "\"JS、原生、服务端同一版本窗口发布\"可能被标记为回滚风险，但 is_realtime 被旧原生桥忽略后安全回退到批量队列，不产生功能错误或数据损坏，发布协调本身不构成高风险——缺少 evidence 表明各端发布不一致会导致功能故障，旧客户端的批量回退是安全的兼容行为",
    "实时上报可能被标记为安全风险（如支付数据实时传输增加暴露面），但输入未提供数据类型、权限边界或传输加密方式的 evidence，仅凭\"上报\"一词无法推导安全缺陷"
  ]
}
